{"$schema":"https://json-schema.org/draft/2020-12/schema","$id":"https://matelink.local/contracts/drive-report-v1.schema.json","title":"MateLink Drive Report V1","type":"object","required":["schema_version","car_id","drive_id","start_date","end_date","duration_seconds","privacy","distance","battery","energy","cost","speed","elevation","temperature","route","series"],"additionalProperties":false,"properties":{"schema_version":{"const":1},"car_id":{"type":"integer","minimum":1},"drive_id":{"type":"integer","minimum":1},"start_date":{"type":"string","minLength":1},"end_date":{"type":"string","minLength":1},"duration_seconds":{"type":"integer","minimum":1},"start_address":{"type":["string","null"]},"end_address":{"type":["string","null"]},"privacy":{"type":"object","required":["addresses_masked_by_default","notification_contains_addresses"],"additionalProperties":false,"properties":{"addresses_masked_by_default":{"const":true},"notification_contains_addresses":{"const":false}}},"distance":{"$ref":"#/$defs/metric"},"odometer_start_km":{"$ref":"#/$defs/nullableMetric"},"odometer_end_km":{"$ref":"#/$defs/nullableMetric"},"rated_range_start_km":{"$ref":"#/$defs/nullableMetric"},"rated_range_end_km":{"$ref":"#/$defs/nullableMetric"},"battery":{"type":"object","required":["start_percent","end_percent","delta_percent"],"additionalProperties":false,"properties":{"start_percent":{"$ref":"#/$defs/nullableMetric"},"end_percent":{"$ref":"#/$defs/nullableMetric"},"delta_percent":{"$ref":"#/$defs/nullableMetric"}}},"energy":{"type":"object","required":["kwh","wh_per_km","source","coverage_seconds","coverage_ratio"],"additionalProperties":false,"properties":{"kwh":{"$ref":"#/$defs/nullableMetric"},"wh_per_km":{"$ref":"#/$defs/nullableMetric"},"source":{"type":"string","enum":["api","power_samples","unavailable"]},"coverage_seconds":{"type":["integer","null"],"minimum":0},"coverage_ratio":{"type":["number","null"],"minimum":0,"maximum":1}}},"cost":{"type":"object","required":["amount","currency","price_per_kwh","source","estimated"],"additionalProperties":false,"properties":{"amount":{"type":["number","null"],"minimum":0},"currency":{"type":"string","minLength":1,"maxLength":8},"price_per_kwh":{"type":["number","null"],"minimum":0},"source":{"type":"string","enum":["flat_tariff_estimate","unavailable"]},"estimated":{"type":"boolean"}}},"speed":{"type":"object","required":["average_kmh","maximum_kmh"],"additionalProperties":false,"properties":{"average_kmh":{"$ref":"#/$defs/nullableMetric"},"maximum_kmh":{"$ref":"#/$defs/nullableMetric"}}},"elevation":{"type":"object","required":["average_m","sample_coverage_ratio"],"additionalProperties":false,"properties":{"average_m":{"$ref":"#/$defs/nullableMetric"},"sample_coverage_ratio":{"type":["number","null"],"minimum":0,"maximum":1}}},"temperature":{"type":"object","required":["inside_average_c","outside_average_c"],"additionalProperties":false,"properties":{"inside_average_c":{"$ref":"#/$defs/nullableMetric"},"outside_average_c":{"$ref":"#/$defs/nullableMetric"}}},"route":{"type":"array","maxItems":360,"items":{"$ref":"#/$defs/routePoint"}},"series":{"type":"array","maxItems":360,"items":{"$ref":"#/$defs/sample"}}},"$defs":{"source":{"type":"string","enum":["direct","derived","estimated","cached","unavailable"]},"metric":{"type":"object","required":["value","source"],"additionalProperties":false,"properties":{"value":{"type":"number"},"source":{"$ref":"#/$defs/source"}}},"nullableMetric":{"type":"object","required":["value","source"],"additionalProperties":false,"properties":{"value":{"type":["number","null"]},"source":{"$ref":"#/$defs/source"}}},"routePoint":{"type":"object","required":["latitude","longitude"],"additionalProperties":false,"properties":{"latitude":{"type":"number","minimum":-90,"maximum":90},"longitude":{"type":"number","minimum":-180,"maximum":180}}},"sample":{"type":"object","required":["timestamp","latitude","longitude","speed_kmh","power_kw","battery_percent","elevation_m","inside_temp_c","outside_temp_c"],"additionalProperties":false,"properties":{"timestamp":{"type":"string","minLength":1},"latitude":{"type":["number","null"],"minimum":-90,"maximum":90},"longitude":{"type":["number","null"],"minimum":-180,"maximum":180},"speed_kmh":{"type":["number","null"],"minimum":0},"power_kw":{"type":["number","null"]},"battery_percent":{"type":["number","null"],"minimum":0,"maximum":100},"elevation_m":{"type":["number","null"]},"inside_temp_c":{"type":["number","null"]},"outside_temp_c":{"type":["number","null"]}}}}}
