{"schema_version":1,"car_id":1,"drive_id":120,"start_date":"2026-08-20T10:30:00+08:00","end_date":"2026-08-20T11:34:00+08:00","duration_seconds":3840,"start_address":"Synthetic Start","end_address":"Synthetic End","privacy":{"addresses_masked_by_default":true,"notification_contains_addresses":false},"distance":{"value":34.9,"source":"direct"},"odometer_start_km":{"value":12345.2,"source":"direct"},"odometer_end_km":{"value":12380.1,"source":"direct"},"rated_range_start_km":{"value":369.0,"source":"direct"},"rated_range_end_km":{"value":372.0,"source":"direct"},"battery":{"start_percent":{"value":80,"source":"direct"},"end_percent":{"value":74,"source":"direct"},"delta_percent":{"value":-6,"source":"derived"}},"energy":{"kwh":{"value":6.4,"source":"direct"},"wh_per_km":{"value":183.4,"source":"derived"},"source":"api","coverage_seconds":null,"coverage_ratio":null},"cost":{"amount":4.48,"currency":"CNY","price_per_kwh":0.7,"source":"flat_tariff_estimate","estimated":true},"speed":{"average_kmh":{"value":32.72,"source":"direct"},"maximum_kmh":{"value":88,"source":"direct"}},"elevation":{"average_m":{"value":42.5,"source":"derived"},"sample_coverage_ratio":1.0},"temperature":{"inside_average_c":{"value":22.0,"source":"direct"},"outside_average_c":{"value":26.0,"source":"direct"}},"route":[{"latitude":30.2501,"longitude":120.1501},{"latitude":30.2601,"longitude":120.1701}],"series":[{"timestamp":"2026-08-20T10:30:00+08:00","latitude":30.2501,"longitude":120.1501,"speed_kmh":0,"power_kw":0,"battery_percent":80,"elevation_m":40,"inside_temp_c":22,"outside_temp_c":26},{"timestamp":"2026-08-20T10:31:00+08:00","latitude":30.2601,"longitude":120.1701,"speed_kmh":42,"power_kw":18,"battery_percent":79,"elevation_m":45,"inside_temp_c":22,"outside_temp_c":26}]}
