{"schema_version":1,"car_id":1,"drive_id":121,"start_date":"2026-08-20T12:00:00+08:00","end_date":"2026-08-20T12:07:00+08:00","duration_seconds":420,"start_address":null,"end_address":null,"privacy":{"addresses_masked_by_default":true,"notification_contains_addresses":false},"distance":{"value":2.1,"source":"cached"},"odometer_start_km":{"value":null,"source":"unavailable"},"odometer_end_km":{"value":null,"source":"unavailable"},"rated_range_start_km":{"value":null,"source":"unavailable"},"rated_range_end_km":{"value":null,"source":"unavailable"},"battery":{"start_percent":{"value":null,"source":"unavailable"},"end_percent":{"value":null,"source":"unavailable"},"delta_percent":{"value":null,"source":"unavailable"}},"energy":{"kwh":{"value":null,"source":"unavailable"},"wh_per_km":{"value":null,"source":"unavailable"},"source":"unavailable","coverage_seconds":0,"coverage_ratio":0.0},"cost":{"amount":null,"currency":"CNY","price_per_kwh":null,"source":"unavailable","estimated":false},"speed":{"average_kmh":{"value":18.0,"source":"derived"},"maximum_kmh":{"value":null,"source":"unavailable"}},"elevation":{"average_m":{"value":null,"source":"unavailable"},"sample_coverage_ratio":null},"temperature":{"inside_average_c":{"value":null,"source":"unavailable"},"outside_average_c":{"value":null,"source":"unavailable"}},"route":[],"series":[]}
